{
  "$schema": "http://json-schema.org/draft-07/schema#",
  "title": "Legacy vulnerability finding (not an operational report)",
  "type": "object",
  "required": ["id", "title", "severity", "cwe", "file", "line", "description", "reproduction_steps", "remediation", "status"],
  "additionalProperties": false,
  "properties": {
    "id": { "type": "string", "minLength": 1 },
    "title": { "type": "string", "minLength": 1 },
    "severity": { "enum": ["CRITICAL", "HIGH", "MEDIUM", "LOW"] },
    "cwe": { "type": "string", "pattern": "^CWE-[0-9]+$" },
    "file": { "type": "string", "minLength": 1 },
    "line": { "type": "integer", "minimum": 1 },
    "description": { "type": "string", "minLength": 1 },
    "reproduction_steps": { "type": "string", "minLength": 1 },
    "remediation": { "type": "string", "minLength": 1 },
    "status": { "enum": ["confirmed", "likely", "plausible", "inconclusive", "false_positive"] }
  }
}
