[
  {
    "id": "FINDING-001",
    "title": "Example Finding",
    "severity": "LOW",
    "cwe": "CWE-20",
    "file": "README.md",
    "line": 1,
    "description": "Example description",
    "reproduction_steps": "Local check",
    "remediation": "Fix documentation",
    "status": "confirmed"
  }
]